{
  "$schema": "../schema/company.json",
  "id": "huaduan",
  "name": "华锻集团",
  "short": "华锻",
  "industry": "forging",
  "plants": [
    {
      "id": "p1",
      "name": "一厂",
      "badge": "一厂",
      "hall": "热模锻车间",
      "sub": "汽车曲轴与连杆，6 条热模锻线",
      "lines": [
        {
          "name": "曲轴 {n} 线",
          "note": "热模锻",
          "product": "crankshaft",
          "route": "hot-die-crank",
          "repeat": 4
        },
        {
          "name": "连杆 {n} 线",
          "note": "热模锻",
          "product": "conrod",
          "route": "hot-die-conrod",
          "repeat": 2
        }
      ],
      "freight": [
        {
          "carrier": "顺达物流",
          "share": 0.6,
          "late": 0.08,
          "truck": 25
        },
        {
          "carrier": "远航货运",
          "share": 0.4,
          "late": 0.16,
          "truck": 25
        }
      ]
    },
    {
      "id": "p2",
      "name": "二厂",
      "badge": "二厂",
      "hall": "环锻车间",
      "sub": "风电法兰与轴承套圈，5 条辗环线",
      "lines": [
        {
          "name": "法兰 {n} 线",
          "note": "辗环",
          "product": "flange",
          "route": "ring-flange",
          "repeat": 3
        },
        {
          "name": "套圈 {n} 线",
          "note": "辗环",
          "product": "bearing-ring",
          "route": "ring-bearing",
          "repeat": 2
        }
      ],
      "freight": [
        {
          "carrier": "远航货运",
          "share": 0.5,
          "late": 0.16,
          "truck": 28
        },
        {
          "carrier": "通衢大件运输",
          "share": 0.5,
          "late": 0.1,
          "truck": 30
        }
      ]
    },
    {
      "id": "p3",
      "name": "三厂",
      "badge": "三厂",
      "hall": "自由锻车间",
      "sub": "大型轴类与模块，4 条自由锻线",
      "warehouse": "钢锭库",
      "finishedGoods": "大件成品库",
      "lines": [
        {
          "name": "主轴 {n} 线",
          "note": "自由锻",
          "product": "shaft",
          "route": "open-die-shaft",
          "repeat": 2
        },
        {
          "name": "模块 {n} 线",
          "note": "自由锻",
          "product": "block",
          "route": "open-die-block",
          "repeat": 2
        }
      ],
      "freight": [
        {
          "carrier": "通衢大件运输",
          "share": 1,
          "late": 0.12,
          "truck": 40
        }
      ]
    }
  ],
  "tariff": {
    "power": [
      {
        "from": 0,
        "to": 7,
        "price": 0.31
      },
      {
        "from": 7,
        "to": 8,
        "price": 0.66
      },
      {
        "from": 8,
        "to": 11,
        "price": 1.05
      },
      {
        "from": 11,
        "to": 18,
        "price": 0.66
      },
      {
        "from": 18,
        "to": 23,
        "price": 1.05
      },
      {
        "from": 23,
        "to": 24,
        "price": 0.31
      }
    ],
    "gas": 3.65
  }
}
